Course_Name,Company_Offering,Skills_Gained,Ratings,Number_of_Ratings,Course_Link
Regulatory Compliance,University of Pennsylvania,"Regulatory Compliance, Regulation and Legal Compliance, Law, Regulation, and Compliance, Finance, Governance Risk Management and Compliance, Health Information Management and Medical Records, Information Privacy, Risk Management, Sarbanes Oxley Act (SOX) Compliance",4.8,1000,https://www.coursera.org/specializations/regulatory-compliance
Data Science,Johns Hopkins University,"R (Programming Language), Data Science, Regression Analysis, Scikit Learn (Machine Learning Library), Statistical Programming, Data Analysis, Statistical Analysis, Data Visualization, Data Wrangling, Natural Language Processing, Statistical Hypothesis Testing, Account Management, Dimensionality Reduction, Git (Version Control System), Machine Learning, Machine Learning Algorithms, Predictive Analytics, Probability Distribution, Programming Concepts, Python (Programming Language), Random Forest Algorithm",4.5,50000,https://www.coursera.org/specializations/jhu-data-science
Google Cloud Digital Leader Training,Google Cloud,"Cloud Engineering, Cloud Computing",4.8,9000,https://www.coursera.org/professional-certificates/google-cloud-digital-leader-training
AI for Medicine,DeepLearning.AI,"Machine Learning, Artificial Intelligence and Machine Learning (AI/ML), Artificial Neural Networks, Deep Learning, Python (Programming Language), Statistical Modeling, Statistical Programming, Bioinformatics, Computer Vision, Data Analysis, Decision Tree Learning, Exploratory Data Analysis, Machine Learning Algorithms, Machine Learning Methods, Natural Language Processing, Natural Language Processing (NLP), Regression Analysis",4.7,3000,https://www.coursera.org/specializations/ai-for-medicine
"Data Engineering, Big Data, and Machine Learning on GCP",Google Cloud,"Big Data, Google Cloud, Machine Learning, Data Pipelines, Cloud Computing, Computing Platforms, Google Cloud Platform (GCP), SQL (Programming Language), Data Management, Apache Spark, Apache Kafka, Apache, Cloud Engineering, Cloud Storage, MLOps (Machine Learning Operations), Natural Language Processing, Python (Programming Language), Statistical Programming, Data Analysis, Data Analysis Software, Data Quality, Data Visualization Software, Data Wrangling, Distributed Computing, Extraction, Transformation, and Loading (ETL), Java, Java (Programming Language), PySpark, Regression Analysis",4.6,18000,https://www.coursera.org/specializations/gcp-data-machine-learning
Algorithms,Stanford University,"Computer Programming, Graph Theory, Algorithms, Data Structures, Programming Concepts, Network Analysis, C (Programming Language), C Based Programming Languages, Cplusplus, Data Mining, Mathematics and Mathematical Modeling, NumPy, Problem Solving, PySpark, Python (Programming Language)",4.8,8000,https://www.coursera.org/specializations/algorithms
"HTML, CSS, and Javascript for Web Developers",Johns Hopkins University,"HTML5, Front End (Software Engineering), Web Development",4.7,16000,https://www.coursera.org/learn/html-css-javascript-for-web-developers
Security Analyst Fundamentals,IBM,"Cybersecurity, Cyber Risk, Cyber Threat Intelligence, Cyber Security Strategy, Incident Response, Penetration Testing, Security Information and Event Management (SIEM), Application Security, Artificial Intelligence, Cyber Security, Cyber Threat Hunting, Data Loss Prevention, DevOps, Digital Forensics, Endpoint Security, IT Security Architecture, Law, Regulation, and Compliance, Mobile Security, Network Protocols, Open Web Application Security Project (OWASP), Payment Card Industry (PCI) Data Security Standards, Python (Programming Language), Scripting Languages, Security Engineering, Software Development, System Software, Vulnerability Assessments, Vulnerability Scanning",4.7,8000,https://www.coursera.org/specializations/security-analyst-fundamentals
Digital Marketing,University of Illinois at Urbana-Champaign,"Digital Marketing, Marketing Analytics, Marketing Strategy and Techniques, Business Modeling, Collaboration, Data Visualization, Marketing, Marketing Strategies, Computer Aided Design, Data Analysis, Design Thinking, Marketing and Public Relations, Product Development, Promotions and Campaigns, Research, Retail Operations, Web Analytics and SEO, Writing and Editing",4.7,22000,https://www.coursera.org/specializations/digital-marketing
"Unsupervised Learning, Recommenders, Reinforcement Learning",DeepLearning.AI,"Machine Learning, Reinforcement Learning, Anomaly Detection, Machine Learning Algorithms, Artificial Intelligence and Machine Learning (AI/ML)",4.9,6000,https://www.coursera.org/learn/unsupervised-learning-recommenders-reinforcement-learning
Operating Systems and You: Becoming a Power User,Google,"Systems Administration, IT Automation, Malware Protection",4.7,27000,https://www.coursera.org/learn/os-power-user
Data Structures and Algorithms,University of California San Diego,"Mathematics and Mathematical Modeling, C (Programming Language), Data Structures, Graph Theory, Algorithms, Computer Programming, Text Mining, Bioinformatics, Programming Concepts, Computational Logic, C Based Programming Languages, Natural Language Processing, Network Analysis, Problem Solving, PySpark, Python (Programming Language)",4.6,16000,https://www.coursera.org/specializations/data-structures-algorithms
Genomic Data Science,Johns Hopkins University,"Bioinformatics, Computer Programming, Python (Programming Language), Statistical Programming, R (Programming Language), Data Analysis, Data Science, Algorithms, Biostatistics, Cloud Management, Computer Science, Data Analysis Software, Descriptive Statistics, Exploratory Data Analysis, Regression Analysis, Unix",4.5,2000,https://www.coursera.org/specializations/genomic-data-science
Foundations of Management,IESE Business School,"Leadership and Management, Accounting, Financial Accounting, Communication, Customer Analysis, Design and Product, Human Resources, Market Analysis, Marketing, Strategy and Operations, Finance, Financial Management, Leadership Development, Marketing Design, Product Marketing, Strategy, Advertising, Employee Relations, Management Accounting, People Development, People Management, Business Psychology, Collaboration, Culture, Financial Analysis",4.8,8000,https://www.coursera.org/specializations/foundations-management
Certified in Cybersecurity,ISC2,"Computer Security Incident Management, Risk Management, Leadership and Management, Network Security, Cryptography, Cyberattacks",4.8,538,https://www.coursera.org/specializations/certified-in-cybersecurity
Reinforcement Learning,University of Alberta,"Machine Learning, Reinforcement Learning, Algorithms, Human Learning, Machine Learning Algorithms, Applied Machine Learning, Computer Programming, Python Programming, Statistical Machine Learning, Statistical Programming, Artificial Neural Networks, Markov Model, Decision Making, Mathematics",4.7,3000,https://www.coursera.org/specializations/reinforcement-learning
Salesforce Sales Operations,Salesforce,"Sales, Customer Relationship Management, Salesforce, Sales Systems, Account Management, Business Process Management, Customer Success, Leadership and Management, Marketing, Operations Management, Strategy, Strategy and Operations, B2B Sales, Databases, Business Analysis, Data Visualization, Data Visualization Software",4.6,3000,https://www.coursera.org/professional-certificates/salesforce-sales-operations
Analyze Data to Answer Questions,Google,"Data Analysis, Data Management, Microsoft Excel, SQL, Spreadsheet Software",4.6,10000,https://www.coursera.org/learn/analyze-data
"Improving Deep Neural Networks: Hyperparameter Tuning, Regularization and Optimization",DeepLearning.AI,"Applied Machine Learning, Deep Learning, Machine Learning, Artificial Neural Networks, Machine Learning Algorithms, Algorithms, Computer Programming, Mathematics, Python Programming, Mathematical Theory & Analysis, Tensorflow, Human Learning",4.9,63000,https://www.coursera.org/learn/deep-neural-network
Data Science: Foundations using R,Johns Hopkins University,"Data Analysis, R Programming, Statistical Programming, Exploratory Data Analysis, Computer Programming, Computer Programming Tools, Data Management, Programming Principles, Data Analysis Software, Data Structures, Statistical Analysis, Critical Thinking, Problem Solving, General Statistics, Process Analysis, Basic Descriptive Statistics, Computational Thinking, Big Data, Data Visualization, Data Visualization Software, Databases, Extract, Transform, Load, Plot (Graphics), Communication, Computer Graphic Techniques, Computer Graphics, Interactive Data Visualization, Knitr, Visualization (Computer Graphics), User Experience",4.6,48000,https://www.coursera.org/specializations/data-science-foundations-r
Achieving Personal and Professional Success,University of Pennsylvania,"Communication, Critical Thinking, Human Learning, People Analysis, Professional Development, Leadership Development, Leadership and Management, Decision Making, Planning, Emotional Intelligence, People Development, Adaptability, Negotiation, Influencing, Innovation",4.7,1000,https://www.coursera.org/specializations/wharton-success
Think like a CFO,IESE Business School,"Finance, Financial Accounting, Accounting, Investment Management, Financial Management, Financial Analysis, Leadership and Management, Risk Management, Business Analysis, Corporate Accouting, Management Accounting",4.8,8000,https://www.coursera.org/specializations/thinklikeacfo
Excel Basics for Data Analysis,IBM,"Microsoft Excel, Spreadsheet Software, Data Analysis, Data Science",4.8,3000,https://www.coursera.org/learn/excel-basics-data-analysis-ibm
Fintech: Foundations & Applications of Financial Technology,University of Pennsylvania,"FinTech, Finance, BlockChain, Innovation, Investment Management, Financial Management, Financial Analysis, Risk Management, General Statistics, Payments, Algorithms, Behavioral Economics, Entrepreneurial Finance, Market Research, Cryptography, Customer Analysis, Human Learning, Machine Learning Algorithms, Machine Learning Software, Securities Trading, System Security, Applied Machine Learning, Machine Learning, Product Strategy, Business Transformation, Systems Design",4.6,5000,https://www.coursera.org/specializations/wharton-fintech
Tools for Data Science,IBM,"Data Science, R Programming, Cloud Computing, Computer Programming, IBM Cloud, Python Programming",4.5,28000,https://www.coursera.org/learn/open-source-tools-for-data-science
Programming for Everybody (Getting Started with Python),University of Michigan,"Algorithms, Computational Logic, Computational Thinking, Computer Programming, Computer Programming Tools, Critical Thinking, Problem Solving, Programming Principles, Python Programming, Software Engineering, Theoretical Computer Science",4.8,226000,https://www.coursera.org/learn/python
Financial Engineering and Risk Management,Columbia University,"Finance, Risk Management, Probability & Statistics, Leadership and Management, Mathematics, Investment Management, Securities Sales, Securities Trading, Computer Programming",4.5,240,https://www.coursera.org/specializations/financialengineering
Entrepreneurship: Growing Your Business,University of Virginia,"Leadership and Management, Strategy and Operations, Strategy, Critical Thinking, Leadership Development, Decision Making, Business Development, Entrepreneurship, Human Learning, Business Analysis, Communication, Finance, Account Management, Accounting, Accounts Payable and Receivable, Emotional Intelligence, Financial Accounting, Financial Analysis, General Accounting, Generally Accepted Accounting Principles (GAAP), Organizational Development, Planning, Problem Solving, Business Transformation, Marketing, Sales, Business Design, Financial Management, Payments, Customer Success, Innovation",4.8,2000,https://www.coursera.org/specializations/entrepreneurship-growing-your-business
Generative AI: Introduction and Applications,IBM,Natural Language Processing,4.6,347,https://www.coursera.org/learn/generative-ai-introduction-and-applications
Successful Negotiation: Essential Strategies and Skills,University of Michigan,"Contract Management, Negotiation, Communication, Decision Making, Strategy",4.8,19000,https://www.coursera.org/learn/negotiation-skills
Data Analysis with R Programming,Google,"R Programming, Data Analysis, Computer Programming, Data Visualization, SQL",4.8,5000,https://www.coursera.org/learn/data-analysis-r
Mathematics for Machine Learning,Imperial College London,"Algebra, Linear Algebra, Mathematics, Machine Learning, Mathematical Theory & Analysis, Computer Programming, Python Programming, Machine Learning Algorithms, Calculus, Algorithms, Differential Equations, Applied Mathematics, Problem Solving, Statistical Analysis, Data Visualization, Dimensionality Reduction, Computer Programming Tools, Regression",4.6,14000,https://www.coursera.org/specializations/mathematics-machine-learning
Databases and SQL for Data Science with Python,IBM,"Python Programming, Computer Programming, Data Analysis, Data Analysis Software, Data Management, Database Application, Database Theory, Databases, SQL, Cloud Computing, IBM Cloud",4.6,19000,https://www.coursera.org/learn/sql-data-science
AI Fundamentals for Non-Data Scientists,University of Pennsylvania,"Machine Learning, Machine Learning Algorithms, Artificial Neural Networks, Data Analysis, Deep Learning, Human Learning, Big Data",4.8,305,https://www.coursera.org/learn/wharton-ai-fundamentals-non-data-scientists
Meta Marketing Analytics,Meta,"Marketing, Digital Marketing, Advertising, Data Analysis, Marketing Management, Media Strategy & Planning, Business Analysis, Statistical Analysis, Probability & Statistics, Market Analysis, Communication, General Statistics, Experiment, Regression, Statistical Tests, Market Research, Basic Descriptive Statistics, Probability Distribution, Brand Management, Forecasting, Research and Design, Data Visualization, Computer Programming, Data Management, Databases, Python Programming, SQL, Statistical Programming, Storytelling, Tableau Software",4.8,2000,https://www.coursera.org/professional-certificates/facebook-marketing-analytics
Capstone: Applying Project Management in the Real World,Google,"Communication, Leadership and Management, Planning, Problem Solving, Project Management",4.8,8000,https://www.coursera.org/learn/applying-project-management
"Assets, Threats, and Vulnerabilities",Google,"Cryptography, Linux",4.8,8000,https://www.coursera.org/learn/assets-threats-and-vulnerabilities
Software Product Management,University of Alberta,"Software Engineering, Agile Software Development, Product Management, Design and Product, Leadership and Management, Project Management, Planning, Application Development, Product Design, Communication, Entrepreneurship, Strategy and Operations, Business Analysis, Collaboration, User Experience, Scrum (Software Development), Supply Chain and Logistics",4.7,11000,https://www.coursera.org/specializations/product-management
Machine Learning with Python,IBM,"Machine Learning, Algorithms, Data Analysis, Human Learning, Python Programming, Regression",4.7,15000,https://www.coursera.org/learn/machine-learning-with-python
Leading People and Teams,University of Michigan,"Human Resources, Leadership and Management, People Development, Strategy and Operations, Leadership Development, Talent Management, Business Psychology, People Analysis, Communication, People Management, Strategy, Human Learning, Human Resources Operations, Business Communication, Collaboration, Influencing, Performance Management, Conflict Management, Business Analysis, Marketing, Recruitment",4.7,10000,https://www.coursera.org/specializations/leading-teams
Introduction to Healthcare,Stanford University,,4.8,854,https://www.coursera.org/learn/intro-to-healthcare
"Influencing: Storytelling, Change Management and Governance",Macquarie University,"Leadership and Management, Communication, Business Psychology, Strategy and Operations, Change Management, Conflict Management, Influencing, Organizational Development, Risk Management, Marketing, Negotiation, Sales, Critical Thinking, Decision Making, Entrepreneurship, Human Resources, Probability & Statistics, Business Communication, Employee Relations, Business Process Management, Finance, Statistical Tests, Tensorflow, Storytelling",4.8,7000,https://www.coursera.org/specializations/influencing-storytelling-change-management
TensorFlow: Advanced Techniques,DeepLearning.AI,"Deep Learning, Machine Learning, Tensorflow, Artificial Neural Networks, Applied Machine Learning, Python Programming, Machine Learning Algorithms, Human Learning, Computer Vision, Computer Programming, Network Model, Machine Learning Software, Network Architecture, Training, Visualization (Computer Graphics), Computer Graphic Techniques, Strategy",4.8,5000,https://www.coursera.org/specializations/tensorflow-advanced-techniques
Preparation for CompTIA A+ Certification,IBM,"Linux, Operating Systems",4.6,36,https://www.coursera.org/specializations/preparation-comptia-certification
Artificial Intelligence in Marketing,University of Virginia,"Digital Marketing, Marketing, Algorithms, Customer Relationship Management, Market Analysis, Strategy, Business Analysis, Machine Learning Algorithms, Market Research, Strategy and Operations",4.5,179,https://www.coursera.org/learn/uva-darden-artificial-intelligence-marketing
Geographic Information Systems  (GIS),"University of California, Davis","ArcGIS, Data Analysis, Data Visualization, GIS Software, Spatial Analysis, Spatial Data Analysis, Data Visualization Software, Databases, Geovisualization, Interactive Data Visualization, Leadership and Management",4.8,9000,https://www.coursera.org/specializations/gis
The Business of Health Care,University of Pennsylvania,"Leadership and Management, Finance, Decision Making, Performance Management, Strategy and Operations, Operations Management, Business Analysis, Financial Analysis, Financial Management, Business Psychology, Accounting, Accounts Payable and Receivable, Financial Accounting, General Accounting, Management Accounting, People Management, People Analysis, Strategy, Business Process Management, Innovation, Leadership Development, Payments, Behavioral Economics, Problem Solving, Compensation, Correlation And Dependence, Insurance Sales, Research and Design, Risk Management",4.6,8000,https://www.coursera.org/specializations/healthcare-administration-management
Share Data Through the Art of Visualization,Google,"Business Communication, Data Analysis, Data Visualization, Data Visualization Software, Tableau Software",4.6,3000,https://www.coursera.org/learn/visualize-data
System Administration and IT Infrastructure Services,Google,"Cloud Computing, Leadership and Management",4.7,24000,https://www.coursera.org/learn/system-administration-it-infrastructure-services
Human Resource Management: HR for People Managers,University of Minnesota,"Human Resources, Human Resources Operations, Employee Relations, Strategy and Operations, People Management, Leadership and Management, Communication, Strategy, Compensation, People Development, Performance Management, Organizational Development, Planning, Professional Development, Recruitment, Business Psychology, People Analysis, Benefits, Business Analysis, Culture",4.8,14000,https://www.coursera.org/specializations/human-resource-management
Introduction to Machine Learning in Production,DeepLearning.AI,"Machine Learning, Applied Machine Learning, Leadership and Management",4.8,8000,https://www.coursera.org/learn/introduction-to-machine-learning-in-production
Private Equity and Venture Capital,Universit Bocconi,"Business Analysis, Entrepreneurial Finance, Finance, Financial Management, Investment Management, Mergers & Acquisitions, Entrepreneurship, Financial Analysis, Leadership and Management, Strategy",4.8,8000,https://www.coursera.org/learn/private-equity
Project Management,University of Colorado Boulder,"Leadership and Management, Project Management, Planning, Strategy and Operations, Product Management, Agile Software Development, People Management, Strategy, Scrum (Software Development), Performance Management, Risk Management, Business Process Management, Business Communication, Decision Making, Organizational Development, Product Development, Data Analysis, Estimation, Budget Management",4.7,598,https://www.coursera.org/specializations/meem-project-management
Strategic Leadership and Management,University of Illinois at Urbana-Champaign,"Leadership and Management, Strategy and Operations, Strategy, Leadership Development, Decision Making, Entrepreneurship, Organizational Development, Business Analysis, Business Process Management, Change Management, Business Design, Business Development, Business Transformation, Communication, Culture, Performance Management, Problem Solving, Operations Management, Human Resources, Marketing, Operational Analysis, Sales, Adaptability, Conflict Management, Influencing, Negotiation, People Development, Business Psychology, Planning, Mergers & Acquisitions, Product Strategy, Research and Design",4.8,9000,https://www.coursera.org/specializations/strategic-leadership
Preparing  Data for Analysis with Microsoft Excel,Microsoft,"Data Analysis, Microsoft Excel, Power BI",4.7,6000,https://www.coursera.org/learn/preparing-data-for-analysis-with-microsoft-excel
Python 3 Programming,University of Michigan,"Python Programming, Computer Programming, Problem Solving",4.7,22000,https://www.coursera.org/specializations/python-3-programming
"TESOL Certificate, Part 2: Teach English Now!",Arizona State University,"Writing, Human Learning, Planning",4.9,9000,https://www.coursera.org/specializations/tesol-certificate-2
Stanford Introduction to Food and Health,Stanford University,,4.7,31000,https://www.coursera.org/learn/food-and-health
Build Wireframes and Low-Fidelity Prototypes,Google,"Product Design, User Experience, User Research",4.9,2000,https://www.coursera.org/learn/wireframes-low-fidelity-prototypes
From Likes to Leads: Interact with Customers Online,Google,"Digital Marketing, Marketing, Marketing Management, Media Strategy & Planning, Social Media, Advertising, Data Analysis, Strategy",4.8,6000,https://www.coursera.org/learn/from-likes-to-leads
Convolutional Neural Networks,DeepLearning.AI,"Artificial Neural Networks, Computer Vision, Machine Learning, Applied Machine Learning, Deep Learning, Machine Learning Software, Machine Learning Algorithms, Network Model, Tensorflow, Algorithms, Human Learning",4.9,42000,https://www.coursera.org/learn/convolutional-neural-networks
IBM Mainframe Developer,IBM,"Computer Programming, Software Engineering, Software Development, Theory of Computation, Agile Methodology, Computer Architecture, Debugging, Software Development Tools, Agile Software Development, Analytics, C (Programming Language), Cloud Native Computing, Cryptography, Database Software, Enterprise Security, Operating Systems, SQL (Programming Language), Software Architecture, Software Development Life Cycle, Systems Development Life Cycle, Test Driven Development (TDD), Unit Testing",4.6,977,https://www.coursera.org/professional-certificates/ibm-mainframe-developer
Foundations of Data Science,Google,"Data Science, Data Analysis, Project Management, Data Visualization Software",4.7,7000,https://www.coursera.org/learn/foundations-of-data-science
Cybersecurity Fundamentals,IBM,"Cybersecurity, Authentications, Cyber Security, Cyber Security Strategy, Encryption, Information Privacy, Information Systems Security, Virtual Private Networks (VPN), Operating Systems",4.8,521,https://www.coursera.org/specializations/cybersecurity-fundamentals
Microsoft Azure Fundamentals AZ-900 Exam Prep,Microsoft,"Cloud Security, Cloud Engineering, Microsoft Azure, Cloud Computing, Cloud Services, Cloud Management, Identity and Access Management, Security Information and Event Management (SIEM), Virtualization and Virtual Machines",4.6,6000,https://www.coursera.org/specializations/microsoft-azure-fundamentals-az-900
Introduction to Cloud Computing,IBM,"Cloud Computing, Cloud Infrastructure, Cloud Services, DevOps",4.6,5000,https://www.coursera.org/learn/introduction-to-cloud
Introduction to Social Media Marketing,Meta,"Marketing, Social Media, Digital Marketing, Marketing Strategy and Techniques",4.8,13000,https://www.coursera.org/learn/social-media-marketing-introduction
Sequence Models,DeepLearning.AI,"Deep Learning, Natural Language Processing, Artificial Neural Networks, Natural Language Processing (NLP)",4.8,30000,https://www.coursera.org/learn/nlp-sequence-models
Generative AI: Prompt Engineering Basics,IBM,"ChatGPT, Generative AI",4.8,224,https://www.coursera.org/learn/generative-ai-prompt-engineering-for-everyone
AI for Good,DeepLearning.AI,"Artificial Intelligence, Artificial Neural Networks, Computer Vision, Emergency Response, Machine Learning, Artificial Intelligence and Machine Learning (AI/ML), Data Analysis Software, Data Visualization, Deep Learning, Geospatial Information and Technology, Image Analysis, Natural Language Processing",4.7,207,https://www.coursera.org/specializations/ai-for-good
Global Procurement and Sourcing,Rutgers the State University of New Jersey,"Supplier Relationship Management, Critical Thinking and Problem Solving, Procurement, Supplier Management, Supply Chain",4.7,2000,https://www.coursera.org/specializations/procurement-sourcing
