Course_Name,Company_Offering,Skills_Gained,Ratings,Number_of_Ratings,Course_Link
Google Data Analytics,Google,"Data Analysis, Spreadsheets, SQL (Programming Language), Data Visualization, R (Programming Language), Data Cleansing, Business Communication, Business Communications, Data Integrity, Tableau (Business Intelligence Software), Data Quality, Advanced Analytics, Analysis, Analytics, Business Analysis, Data Collection, Data Management, Graphing, Information Privacy, Relational Databases, Statistical Graphics, Statistics, Teamwork, Text Mining, Unstructured Data",4.8,142000,https://www.coursera.org/professional-certificates/google-data-analytics
Google Cybersecurity,Google,"Cybersecurity, Incident Response, Network Security, Python (Programming Language), Cyber Risk, Incident Management, Linux, Operating Systems, Security Information and Event Management (SIEM), Security Management, Network Protocols, TCP/IP, Bash (Scripting Language), Authorization (Computing), Cloud Computing, Firewall, Intrusion Detection and Prevention, Open Web Application Security Project (OWASP), SQL (Programming Language), Authentications, Business Communications, Computer Hardware, Cyber Defense, Cyber Security, Encryption, General Networking, Hardening, Malware Analysis, Malware Protection, Network Switches, Networking Hardware, Penetration Testing, Public Key Infrastructure, Relational Databases, Risk Management Framework, Security Controls, Single Sign-On (SSO), Splunk, Systems Administration, Threat Modeling, User Interface (UI), Virtual Private Networks (VPN), Vulnerability Assessments, Vulnerability Management, Wide Area Networks",4.8,27000,https://www.coursera.org/professional-certificates/google-cybersecurity
Google Project Management:,Google,"Project Management, Operations Management, Strategic Planning, Management, Communications, Business Communication, Collaboration, Agile Methodology, Agile Software Development, Software Engineering, Entrepreneurship, Scrum (Software Development), Planning, Supply Chain, Change Management, Finance, Industrial and Organizational Psychology, Organizational Development, Product Management, Project Planning, Quality Management, Risk Management, Budget Management, Business Communications, Communication, Conflict Management, Critical Thinking and Problem Solving, Human Resource Planning, Influencing Skills, Product Design, Project Schedules, Quality Management Systems, Risk Analysis, Storytelling, Teamwork, User Story, Waterfall Methodology, Writing",4.8,105000,https://www.coursera.org/professional-certificates/google-project-management
IBM Data Science,IBM,"Python (Programming Language), Data Science, SQL (Programming Language), Machine Learning, Pandas (Python Package), Scikit Learn (Machine Learning Library), Decision Tree Learning, NumPy, Regression Analysis, Application Programming Interface (API), Data Collection, Data Visualization, Databases, Relational Databases, Restful API, Dashboard, Data Analysis, Data Analysis Software, Data Cleansing, Extraction, Transformation, and Loading (ETL), Git (Version Control System), GitHub, PySpark, R (Programming Language)",4.6,124000,https://www.coursera.org/professional-certificates/ibm-data-science
Google Digital Marketing & E-commerce,Google,"Digital Marketing, Marketing, Marketing Management, Media Strategy, Marketing Analytics, Data Analysis, Email Marketing, Social Media, Search Engine Optimization, E Commerce, Marketing Strategy and Techniques, Sales, Advertisement, Communications, Marketing Strategies, Operations Management, Strategic Planning, Brand Management, Branding, Business Communication, Business Communications, Customer Success Management, Data Visualization, Graphical Tools, Management, Persona Development, Research and Development, Search Engine Marketing, Strategic Thinking, Survey Development, Training and Development, Web Design, Web Development, Web Development Tools, Writing",4.8,25000,https://www.coursera.org/professional-certificates/google-digital-marketing-ecommerce
IBM Data Analyst,IBM,"Python (Programming Language), Pandas (Python Package), SQL (Programming Language), Data Visualization, Data Cleansing, Microsoft Excel, Spreadsheets, Analysis, Data Analysis, Data Wrangling, Databases, Exploratory Data Analysis, Relational Databases, Advanced Analytics, Analytics, Application Programming Interface (API), Correlation Analysis, Dashboard, Database Software, Graphing, Restful API, Apache Spark, Data Collection, Data Management, Data Mining, Data Quality, Data Science, Data Structures, Data Warehousing, Extraction, Transformation, and Loading (ETL), HTML5, Mathematics, NoSQL, NumPy, R (Programming Language), Statistical Graphics, Statistics, Unstructured Data",4.6,75000,https://www.coursera.org/professional-certificates/ibm-data-analyst
Google UX Design,Google,"User Experience (UX), User Experience (UX) Design, User Centered Design, Design Thinking, User Research, Agile Methodology, Figma (Design Software), Graphic and Visual Design, Human Centered Design, Product Design, UI/UX Research, User Interface and User Experience (UI/UX) Design, Value Propositions, Visual Design",4.8,78000,https://www.coursera.org/professional-certificates/google-ux-design
Google IT Support,Google,"Systems Administration, Linux, Operating Systems, Network Troubleshooting, Cybersecurity, Technical Support, Network Administration, Computer Networks, Configuration Management, Identity and Access Management, Windows PowerShell, Ruby (Programming Language), Software Installation, TCP/IP, Active Directory, Authorization (Computing), Cyber Security Strategy, Git (Version Control System), IT Management, Information Systems Security, Network Architecture, Network Protocols, Scripting Languages, Version Control, Virtualization, Virtualization and Virtual Machines, Ansible, Apache, Authentications, Automation, Business Communication, Business Communications, Cloud Clients, Cloud Storage, Communication, Communications, Computer Architecture, Computer Hardware, Computer Security, Cryptography, Customer Service, Cyber Security, Dashboard, Debugging, Disaster Recovery, Encryption, Google Cloud, IT Infrastructure, Network Analysis, Process Improvement and Optimization, Security Management, Servers, Service Design, Software as a Service (SaaS), Technical Assistance, Unix, Web Services",4.8,186000,https://www.coursera.org/professional-certificates/google-it-support
Machine Learning,Multiple educators,"Machine Learning, Machine Learning Methods, Artificial Neural Networks, Deep Learning, Machine Learning Algorithms, Regression Analysis, Reinforcement Learning, Scikit Learn (Machine Learning Library), TensorFlow, Decision Tree Learning, Anomaly Detection, Feature Engineering, Random Forest Algorithm",4.9,22000,https://www.coursera.org/specializations/machine-learning-introduction
IBM Applied AI,IBM,"Natural Language Processing, Artificial Intelligence, Python (Programming Language), Computer Vision, Artificial Intelligence and Machine Learning (AI/ML), Artificial Neural Networks, Image Analysis, Machine Learning, Restful API, Application Programming Interface (API), ChatGPT, Natural Language Processing (NLP), NumPy, Pandas (Python Package)",4.6,49000,https://www.coursera.org/professional-certificates/applied-artifical-intelligence-ibm-watson-ai
IBM DevOps and Software Engineering,IBM,"DevOps, Software Engineering, Python (Programming Language), Cloud Computing, Test Driven Development (TDD), Continuous Integration, Agile Methodology, Application Security, Continuous Delivery, Kubernetes, Security Engineering, Bash (Scripting Language), Microservices, Software Testing, Agile Software Development, Computer Programming, Continuous Monitoring, Application Development, CI/CD, Cloud Engineering, Cloud Native Computing, Containerization, Git (Version Control System), GitHub, Linux, Programming Concepts, Restful API, Software Development, Application Programming Interface (API), Cloud Applications, Cloud Infrastructure, Cloud Management, Cloud Security, Cloud Services, Cloud Storage, Cloud Technologies, Computing Platforms, Cybersecurity, Data Visualization, Data Visualization Software, Docker (Software), IBM Cloud Computing, Network Security, NumPy, Pandas (Python Package), Sass, Scrum (Software Development), Security Software, Security Testing, Software Architecture, Software Development Life Cycle, Software as a Service (SaaS), Teamwork, Version Control",4.6,46000,https://www.coursera.org/professional-certificates/devops-and-software-engineering
Introduction to Data Science,IBM,"Data Science, SQL (Programming Language), Scikit Learn (Machine Learning Library), Databases, Python (Programming Language), Relational Databases, Data Analysis Software, Data Cleansing, Data Collection, Git (Version Control System), GitHub, PySpark, R (Programming Language)",4.6,88000,https://www.coursera.org/specializations/introduction-data-science
IBM Full Stack Software Developer,IBM,"Cloud Computing, Cloud Applications, IBM Cloud, Cloud Infrastructure, DevOps, Cloud Platforms, Computer Programming, Javascript, Python Programming, Cloud Management, Web Development, Software Architecture, Application Development, Cloud API, Cloud-Based Integration, Software Engineering, Microarchitecture, Cloud Storage, Continuous Delivery, Continuous Integration, Full-Stack Web Development, Software As A Service, Web Development Tools, Docker (Software), Kubernetes, Software Engineering Tools, Software Testing, Django (Web Framework), NoSQL, SQL, Collaboration, Computer Science, Data Analysis, Front-End Web Development, Leadership and Management, Mergers & Acquisitions, React (web framework)",4.6,44000,https://www.coursera.org/professional-certificates/ibm-full-stack-cloud-developer
Data Science Fundamentals with Python and SQL,IBM,"Python Programming, Data Analysis, General Statistics, Probability & Statistics, Basic Descriptive Statistics, Statistical Analysis, Statistical Tests, Mathematical Theory & Analysis, Statistical Programming, Computer Programming, Data Analysis Software, Data Visualization, Data Science, R Programming, Data Management, Database Application, Database Theory, Databases, SQL, Cloud Computing, IBM Cloud",4.6,62000,https://www.coursera.org/specializations/data-science-fundamentals-python-sql
Key Technologies for Business,IBM,"Algorithms, Applied Machine Learning, Artificial Neural Networks, Computer Vision, Deep Learning, Human Learning, Machine Learning, Machine Learning Algorithms, Machine Learning Software, Cloud Computing, Adaptability, Big Data, Data Analysis, Cloud Applications, Cloud Infrastructure, Cloud Platforms, Cloud Storage, DevOps, Data Mining, IBM Cloud, Data Science, Regression, Writing",4.7,85000,https://www.coursera.org/specializations/key-technologies-for-business
IBM Data Engineering,IBM,"Data Management, Databases, Database Administration, Extract, Transform, Load, Python Programming, Big Data, SQL, Apache, Database Design, Distributed Computing Architecture, Data Architecture, Database Application, NoSQL, Data Structures, Data Model, Data Warehousing, Cloud Computing, Database Theory, Data Engineering, Data Visualization, Computer Programming, IBM Cloud, Data Mining, Machine Learning, Data Analysis, Data Analysis Software, Leadership and Management, Process Analysis, Kubernetes, Software Architecture, PostgreSQL, Business Intelligence, Data Visualization Software, Linux, Network Security, Statistical Programming, Data Science",4.6,49000,https://www.coursera.org/professional-certificates/ibm-data-engineer
IBM & Darden Digital Strategy,University of Virginia Darden School Foundation,"Business Analysis, Business Transformation, Strategy, Data Analysis, Cloud Computing, Strategy and Operations, Applied Machine Learning, Big Data, Data Visualization, Deep Learning, Entrepreneurship, Leadership and Management, Research and Design, Algorithms, Artificial Neural Networks, Computer Vision, Human Learning, Innovation, Machine Learning, Machine Learning Algorithms, Machine Learning Software, Marketing, Sales, Adaptability, Market Analysis, Business Design, Business Development, Customer Analysis, Product Strategy, Data Management, Data Mining, Databases, Python Programming, SQL, Cloud Applications, Cloud Infrastructure, Cloud Platforms, Cloud Storage, Data Science, DevOps, IBM Cloud, NoSQL, R Programming, Microsoft Excel",4.7,32000,https://www.coursera.org/specializations/digital-strategy
Data Engineering Foundations,IBM,"Data Management, Python Programming, Databases, Data Structures, Data Engineering, Database Application, SQL, Database Administration, Database Design, Extract, Transform, Load, Computer Programming, Data Architecture, Database Theory, Data Mining, Data Model, Data Analysis, Data Analysis Software, Leadership and Management, Data Warehousing, PostgreSQL, Big Data, IBM Cloud, Network Security, NoSQL, Cloud Computing, Data Science",4.6,47000,https://www.coursera.org/specializations/data-engineering-foundations
Applied Data Science,IBM,"Python Programming, Data Analysis, Machine Learning, Algorithms, Computer Programming, Data Science, Data Visualization, Exploratory Data Analysis, General Statistics, Machine Learning Algorithms, Plot (Graphics), Probability & Statistics, Regression",4.6,50000,https://www.coursera.org/specializations/applied-data-science
IBM AI Foundations for Business,IBM,"Machine Learning, Machine Learning Algorithms, Data Analysis, Deep Learning, Applied Machine Learning, Data Management, Leadership and Management, Algorithms, Artificial Neural Networks, Computer Vision, Human Learning, Machine Learning Software, Business Process Management, Data Architecture, Strategy and Operations, Adaptability, Business Transformation, Strategy, Big Data, Innovation, Data Mining, Data Science, Regression, Writing",4.7,80000,https://www.coursera.org/specializations/ibm-ai-foundations-for-business
IBM Back-End Development,IBM,"Software Engineering, Application Development, Software Architecture, Computer Programming, Python Programming, Software Engineering Tools, Cloud Applications, DevOps, Security Engineering, Cloud Computing, Programming Principles, Cloud Infrastructure, Cloud-Based Integration, Microarchitecture, Agile Software Development, Communication, Full-Stack Web Development, IBM Cloud, Kubernetes, Software Security, Cloud Platforms, Software Testing, Docker (Software), Linux, Software-Defined Networking, Web Development, Collaboration, Leadership and Management, Data Analysis, Django (Web Framework), Mergers & Acquisitions, SQL",4.6,39000,https://www.coursera.org/professional-certificates/ibm-backend-development
IBM Data Analytics with Excel and R,IBM,"Data Analysis, R Programming, Computer Programming, Data Visualization, Data Management, Statistical Programming, Databases, Exploratory Data Analysis, Plot (Graphics), Data Analysis Software, Data Structures, Statistical Analysis, Statistical Visualization, Basic Descriptive Statistics, Microsoft Excel, SQL, General Statistics, Interactive Data Visualization, Database Application, Extract, Transform, Load, Visualization (Computer Graphics), Spreadsheet Software, Database Design, Database Theory, Programming Principles, Database Administration, Computer Programming Tools, Correlation And Dependence, Data Mining, Data Visualization Software, Statistical Machine Learning, Visual Design, Business Analysis, Python Programming, Big Data, Data Science, NoSQL",4.7,22000,https://www.coursera.org/professional-certificates/ibm-data-analyst-r-excel
Data Analysis and Visualization Foundations,IBM,"Microsoft Excel, Data Visualization, Spreadsheet Software, Data Analysis, Plot (Graphics), Business Analysis, Data Management, Databases, Python Programming, SQL, Statistical Visualization, Big Data, Data Mining, Data Science, Interactive Data Visualization, NoSQL, R Programming, Data Visualization Software",4.7,21000,https://www.coursera.org/specializations/data-analysis-visualization-foundations
Applied Software Engineering Fundamentals,IBM,"Software Engineering, Computer Programming, Python Programming, Software Engineering Tools, Application Development, Programming Principles, Software Architecture, Agile Software Development, Communication, Full-Stack Web Development, Software Testing, Software-Defined Networking, Collaboration, Leadership and Management, Linux, Data Analysis, Mergers & Acquisitions",4.6,38000,https://www.coursera.org/specializations/software-engineering-fundamentals
Deep Learning,DeepLearning.AI,"Machine Learning, Deep Learning, Artificial Neural Networks, Machine Learning Algorithms, Applied Machine Learning, Python Programming, Machine Learning Software, Network Model, Algorithms, Computer Programming, Computer Vision, Network Architecture, Natural Language Processing, Tensorflow, Human Learning, Data Analysis, Exploratory Data Analysis, Organizational Development, Strategy, Mathematics, Mathematical Theory & Analysis, Linear Algebra, Regression, Calculus",4.8,143000,https://www.coursera.org/specializations/deep-learning
AI Foundations for Everyone,IBM,"Human Learning, Machine Learning, Artificial Neural Networks, Deep Learning, Machine Learning Algorithms, Human Computer Interaction, Natural Language Processing, Algorithms, Applied Machine Learning, Cloud Computing, Computer Vision, IBM Cloud, Machine Learning Software, Adaptability, Customer Analysis, Computer Programming, Data Science",4.7,14000,https://www.coursera.org/specializations/ai-foundations-for-everyone
Prompt Engineering,Vanderbilt University,"Creativity, Data Analysis, Problem Solving, Writing",4.8,7000,https://www.coursera.org/specializations/prompt-engineering
IBM Business Intelligence (BI) Analyst,SkillUp EdTech,"Data Management, Data Visualization, Databases, SQL, Database Administration, Database Application, Database Design, Microsoft Excel, Data Structures, Python Programming, Data Analysis, Data Architecture, Database Theory, Spreadsheet Software, Computer Programming, Data Model, Data Warehousing, General Statistics, Plot (Graphics), Statistical Visualization, Basic Descriptive Statistics, Probability & Statistics, Statistical Analysis, Statistical Tests, Data Analysis Software, NoSQL, PostgreSQL, Professional Development, Probability Distribution, Business Analysis, Data Visualization Software, Data Mining, Data Science, Interactive Data Visualization, R Programming, Tableau Software, Business Intelligence, Forecasting",4.7,10000,https://www.coursera.org/professional-certificates/bi-analyst
Cloud Application Development Foundations,IBM,"Cloud Computing, Cloud Applications, IBM Cloud, Javascript, Cloud Infrastructure, Cloud Platforms, DevOps, Cloud Management, Computer Programming, Web Development, Cloud API, Continuous Integration, Cloud Storage, Software As A Service, Continuous Delivery, Web Development Tools, NoSQL, Computer Science, Front-End Web Development, React (web framework)",4.6,4000,https://www.coursera.org/specializations/ibm-cloud-application-development-foundations
Generative AI with Large Language Models,DeepLearning.AI,"Machine Learning, Natural Language Processing, Python Programming",4.8,2000,https://www.coursera.org/learn/generative-ai-with-llms
Google Advanced Data Analytics,Google,"Communication, Computer Programming, Data Analysis, Data Visualization, Exploratory Data Analysis, General Statistics, Machine Learning, Planning, Probability Distribution, Project Management, Python Programming, Regression, Statistical Analysis, Tableau Software",4.7,1000,https://www.coursera.org/professional-certificates/google-advanced-data-analytics
Microsoft Power BI Data Analyst,Microsoft,"Data Analysis, Data Management, Data Mining, Data Model, Data Visualization, Extract, Transform, Load, Microsoft Excel, Power BI, SQL",4.6,4000,https://www.coursera.org/professional-certificates/microsoft-power-bi-data-analyst
"DevOps, Cloud, and Agile Foundations",IBM,"DevOps, Cloud Computing, Software Engineering, Agile Software Development, Continuous Delivery, Continuous Integration, Scrum (Software Development), Cloud Applications, Cloud Infrastructure, Cloud Platforms, Cloud Storage, IBM Cloud, Leadership and Management",4.7,9000,https://www.coursera.org/specializations/devops-cloud-and-agile-foundations
IBM and ISC2 Cybersecurity Specialist,Multiple educators,"Computer Security Incident Management, Risk Management, Cloud Computing, System Security, Computer Networking, Cloud Storage, Operating Systems, Leadership and Management, Network Security, Cloud Platforms, Network Architecture, Networking Hardware, Cloud Applications, Cloud Infrastructure, Computer Programming, Cyberattacks, Databases, DevOps, Security Engineering, Cryptography, IBM Cloud, Software Engineering",4.7,9000,https://www.coursera.org/professional-certificates/ibm-isc2-cybersecurity-specialist
IBM IT Support,IBM,"Cloud Computing, Computer Networking, Cloud Storage, Customer Success, Operating Systems, Leadership and Management, System Security, Strategy and Operations, Cloud Applications, Cloud Infrastructure, Cloud Platforms, Communication, Computer Programming, Cyberattacks, Customer Support, Databases, DevOps, Networking Hardware, Cryptography, IBM Cloud, Information Technology, Network Architecture, Network Security, Security Engineering, Software Engineering",4.7,6000,https://www.coursera.org/professional-certificates/ibm-technical-support
Foundations of Project Management,Google,"Project Management, Strategy and Operations, Business Communication, Change Management, Organizational Development, Communication, Culture, Emotional Intelligence, Influencing, Leadership and Management, People Management, Planning",4.9,79000,https://www.coursera.org/learn/project-management-foundations
IBM Data Warehouse Engineer,IBM,"SQL (Programming Language), Relational Databases, Data Engineering, Database Software, Data Management, Data Warehousing, Apache Spark, Apache Kafka, Data Administration, Bash (Scripting Language), Apache Airflow, Data Modeling, Data Visualization, Extraction, Transformation, and Loading (ETL), Data Pipelines, Data Visualization Software, Database Architecture and Administration, Database Theory, Databases, Linux, Apache, Big Data, Business Intelligence, Data Wrangling, Database Design, Disaster Recovery, Extensible Languages and XML, Management, MySQL, Network Security, PySpark, Python (Programming Language), Scripting, Security Engineering, Training and Development",4.7,2000,https://www.coursera.org/professional-certificates/data-warehouse-engineering
Generative AI Fundamentals,IBM,,4.7,547,https://www.coursera.org/specializations/generative-ai-for-everyone
Meta Front-End Developer,Meta,"Javascript (Programming Language), React.js, Hypertext Markup Language (HTML), CSS Frameworks, HTML Formatting, Web Design, CSS Codes, Cascading Style Sheets (CSS), HTML5, React Native, User Interface (UI), Data Structures, Front End (Software Engineering), Git (Version Control System), UI Components, User Experience (UX), User Interface (UI) Design, Application Programming Interface (API), Bash (Scripting Language), Jest (JavaScript Testing Framework), Mobile Development, Object Oriented Programming (OOP), Programming Concepts, UI/UX Strategy, Unit Testing, User Centered Design, User Experience (UX) Design, Web Development, Algorithms, Application Frameworks, Bootstrap (Front-End Framework), C (Programming Language), Computer Networks, Computer Science, Design, Digital Design, GitHub, Interaction Design, JavaScript Frameworks, Programming Tools, Prototyping, Software Development Tools, UI/UX Research, Unix, Usability, Usability Testing, User Interface and User Experience (UI/UX) Design, Version Control, Web Application Development, Webpack",4.7,17000,https://www.coursera.org/professional-certificates/meta-front-end-developer
Generative AI for Data Analysts,IBM,,4.7,493,https://www.coursera.org/specializations/generative-ai-for-data-analysts
IBM Generative AI for Cybersecurity Professionals,IBM,,4.7,493,https://www.coursera.org/specializations/generative-ai-for-cybersecurity-professionals
"BI Foundations with SQL, ETL and Data Warehousing",IBM,"SQL (Programming Language), Apache Kafka, Bash (Scripting Language), Apache Airflow, Data Warehousing, Data Management, Data Pipelines, Databases, Linux, Relational Databases, Data Visualization, Data Visualization Software, Python (Programming Language)",4.6,20000,https://www.coursera.org/specializations/bi-foundations-sql-etl-data-warehouse
Generative AI for Data Scientists,IBM,,4.7,496,https://www.coursera.org/specializations/generative-ai-for-data-scientists
Generative AI for Software Developers,IBM,,4.7,496,https://www.coursera.org/specializations/generative-ai-for-software-developers
Generative AI for Data Engineers,IBM,,4.7,489,https://www.coursera.org/specializations/generative-ai-for-data-engineers
