Course_Name,Company_Offering,Skills_Gained,Ratings,Number_of_Ratings,Course_Link
Introduction to Cyber Security,New York University,"Security Engineering, Cyberattacks, Network Security, System Security, Security Strategy, Computer Networking, Security Software, Computer Security Models, Network Architecture, Strategy, Cryptography, Problem Solving, Software Security, Algorithms, Computer Security Incident Management, Critical Thinking, Computational Thinking, BlockChain, Cloud Computing, Mobile Security",4.7,4000,https://www.coursera.org/specializations/intro-cyber-security
Programming with JavaScript,Meta,"Javascript, Front-End Web Development, Computer Programming, Web Development Tools",4.7,8000,https://www.coursera.org/learn/programming-with-javascript
Learning How to Learn: Powerful mental tools to help you master tough subjects,Deep Teaching Solutions,"Business Psychology, Entrepreneurship, Human Learning, Leadership and Management",4.8,89000,https://www.coursera.org/learn/learning-how-to-learn
Become an EMT,University of Colorado System,"Emergency and Intensive Care, Cardiopulmonary Resuscitation (CPR), Emergency Response, Direct Patient Care, Emergency Services, Communication, First Aid, General Medical Tests and Procedures, Nursing, Vital Signs",4.8,3000,https://www.coursera.org/specializations/become-an-emt
Reducing Gun Violence in America: Evidence for Change,Johns Hopkins University,"Exploratory Data Analysis, Patient Safety",4.7,264,https://www.coursera.org/learn/gun-violence
Introduction to Cosmetic Science and Ingredients,Olay,,4.3,7,https://www.coursera.org/specializations/introduction-to-cosmetic-science
Microsoft Azure Data Scientist Associate (DP-100),Microsoft,"MLOps (Machine Learning Operations), Machine Learning, PySpark, Databricks, Microsoft Azure, Deep Learning, Scikit Learn (Machine Learning Library), Apache Spark, Python (Programming Language)",4.3,344,https://www.coursera.org/professional-certificates/azure-data-scientist
Biostatistics in Public Health,Johns Hopkins University,"Regression Analysis, Statistical Hypothesis Testing, Biostatistics, Probability and Statistics, Statistics, Descriptive Statistics",4.8,2000,https://www.coursera.org/specializations/biostatistics-public-health
Building AI Powered Chatbots Without Programming,IBM,"ChatGPT, Natural Language Processing (NLP), Servers",4.8,6000,https://www.coursera.org/learn/building-ai-powered-chatbots
Investment Management,University of Geneva,"Investment Management, Finance, Financial Analysis, Risk Management, Critical Thinking and Problem Solving, Economics, Financial Industry Regulatory Authorities",4.7,3000,https://www.coursera.org/specializations/investment-management
ITIL 4 Exam Preparation,LearnQuest,"IT Service Management, Service Design, Information Technology Infrastructure Library",4.7,1000,https://www.coursera.org/learn/itil-4-exam-preparation
Trustworthy Generative AI,Vanderbilt University,"ChatGPT, Generative AI",4.8,121,https://www.coursera.org/learn/trustworthy-generative-ai
Artificial Intelligence (AI) Education for Teachers,Macquarie University,"Artificial Intelligence, Artificial Intelligence and Machine Learning (AI/ML), Design Thinking, Machine Learning, Machine Learning Methods",4.7,413,https://www.coursera.org/learn/artificial-intelligence-education-for-teachers
Introduction to Corporate Finance,University of Pennsylvania,"Finance, Cash Flow Forecasting, General Finance",4.6,9000,https://www.coursera.org/learn/wharton-finance
Human Anatomy and Medical Terminology Fundamentals,MedCerts,,4.7,75,https://www.coursera.org/specializations/human-anatomy-medical-terminology-fundamentals
U.S. Federal Taxation,University of Illinois at Urbana-Champaign,"Taxes, Accounting, Financial Accounting, Finance, Critical Thinking, General Accounting, Regulations and Compliance, Financial Analysis, Corporate Accouting, Generally Accepted Accounting Principles (GAAP), Problem Solving, Benefits",4.8,841,https://www.coursera.org/specializations/united-states-federal-taxation
Large Language Model Operations (LLMOps),Duke University,"Cloud API, Cloud Computing, Data Science, Machine Learning, Python Programming",4.4,9,https://www.coursera.org/specializations/large-language-model-operations
Introduction to Software Engineering,IBM,"Software Engineering, Computer Programming, Software Engineering Tools, Application Development, Programming Principles, Software Architecture, Agile Software Development, Communication, Full-Stack Web Development, Software-Defined Networking, Python Programming",4.7,838,https://www.coursera.org/learn/introduction-to-software-engineering
Design a User Experience for Social Good & Prepare for Jobs,Google,"User Experience, User Research, Web Design",4.8,3000,https://www.coursera.org/learn/ux-design-jobs
Excel/VBA for Creative Problem Solving,University of Colorado Boulder,"Spreadsheet Software, Computer Programming, Problem Solving, Microsoft Excel, Programming Principles, Data Analysis, Critical Thinking, Algorithms, Computer Programming Tools, Computational Logic, Computational Thinking",4.8,6000,https://www.coursera.org/specializations/excel-vba-creative-problem-solving
Databases for Data Scientists,University of Colorado Boulder,"Databases, Data Management, SQL, Database Design, Database Administration, Data Model, Database Theory, PostgreSQL, Critical Thinking, Database Application, Problem Solving, Data Analysis, Data Structures, Big Data, NoSQL, Supply Chain and Logistics, Data Science, Data Warehousing",4.7,736,https://www.coursera.org/specializations/databases-for-data-scientists
AI Applications in Marketing and Finance,University of Pennsylvania,"Business Analysis, Machine Learning, Customer Analysis, Finance, Financial Accounting, Marketing, Probability & Statistics, Statistical Machine Learning, User Experience",4.7,207,https://www.coursera.org/learn/wharton-ai-applications-marketing-finance
"Songwriting: Writing, Arranging, and Producing Music",Berklee,Writing,4.8,2000,https://www.coursera.org/specializations/songwriting
Decentralized Finance (DeFi): The Future of Finance,Duke University,"BlockChain, FinTech, Finance, Algorithms, Cryptography, Payments, Banking, Risk Management, Contract Management, Computational Logic, Innovation, Regulations and Compliance, Securities Trading, Data Mining, Strategy and Operations, Cyberattacks, Financial Analysis, Security Engineering",4.8,7000,https://www.coursera.org/specializations/decentralized-finance-duke
Learn Spanish: Basic Spanish Vocabulary,"University of California, Davis","Communication, Writing, Culture",4.6,6000,https://www.coursera.org/specializations/learn-spanish
Organizational Leadership,Northwestern University,"Leadership and Management, Communication, Leadership Development, Strategy and Operations, Critical Thinking, Decision Making, Strategy, Business Psychology, Collaboration, People Analysis, People Development, Performance Management, Influencing, Change Management, Employee Relations, Negotiation, Marketing, Innovation, Storytelling",4.7,6000,https://www.coursera.org/specializations/organizational-leadership
From Data to Insights with Google Cloud,Google Cloud,"Google Cloud Platform, Cloud Computing, SQL, Databases, Data Analysis, Big Data, Cloud Platforms, Data Management, Exploratory Data Analysis, Data Analysis Software, Data Model, Machine Learning, Applied Machine Learning, Human Learning, Data Visualization, Machine Learning Software, Database Theory",4.6,6000,https://www.coursera.org/specializations/from-data-to-insights-google-cloud-platform
Salesforce Sales Development Representative,Salesforce,"Sales Prospecting, Consultative Selling, Business Communications, Specialized Sales, Business To Business (B2B) Sales, Communication, Data Analysis, Sales Engineering, Selling Techniques, Technical Support, Workflow Management",4.5,437,https://www.coursera.org/professional-certificates/sales-development-representative
"Introduction to Web Development with HTML, CSS, JavaScript",IBM,"HTML5, Front End (Software Engineering), Javascript and jQuery, Web Development, Cascading Style Sheets (CSS), Cloud Applications",4.6,9000,https://www.coursera.org/learn/introduction-to-web-development-with-html-css-javacript
"Make the Sale: Build, Launch, and Manage E-commerce Stores",Google,"E Commerce, Sales, Advertisement, Digital Marketing, Go To Market Strategy, Marketing, Marketing Management, Media Strategy",4.8,1000,https://www.coursera.org/learn/make-the-sale
SAP Professional Fundamentals,SAP,"Business Strategies, Business Transformation, SAP Applications, Business Intelligence Software",4.7,499,https://www.coursera.org/learn/sap-professional-fundamentals
Web Applications for Everybody,University of Michigan,"PHP (Scripting Language), Javascript and jQuery, SQL (Programming Language), AJAX (Programming Language), Cybersecurity, Databases, HTML5, MySQL, Web Application Development, Web Design and Development, Web Development",4.7,9000,https://www.coursera.org/specializations/web-applications
Object Oriented Programming in Java,Multiple educators,"Java, Computer Programming, Data Structures, Object Oriented Programming (OOP), Java (Programming Language), Cplusplus, Programming Concepts, Cryptography, JUnit",4.6,15000,https://www.coursera.org/specializations/object-oriented-programming
Marketing Mix Implementation,IE Business School,"Marketing, Brand Management, Integrated Marketing Communications, Market Research, Advertisement, Business Analysis, Communications, Customer Analysis, Market Analysis, Media Strategy, Product Design, Product Strategy, Customer Relationship Management, Experience Design, Finance, Industrial and Organizational Psychology, Marketing Channel, Marketing Effectiveness, Retail Management, Digital Marketing, Entrepreneurship, Management, Marketing Management, Marketing Strategy and Techniques, Operations Management, Product Management, Public Relations, Research and Development, Sales, Strategic Planning, Strategic Thinking",4.7,6000,https://www.coursera.org/specializations/marketing-mix
Fundamentals of Finance,University of Pennsylvania,"Cash Flow Forecasting, Entrepreneurial Finance, General Finance",3.9,877,https://www.coursera.org/learn/finance-fundamentals
Global Diplomacy  Diplomacy in the Modern World,University of London,"Business Communications, Negotiation",4.7,7000,https://www.coursera.org/learn/global-diplomacy
Cybersecurity Operations Fundamentals,Cisco Learning and Certifications,"Cybersecurity, Cyber Threat Hunting, Endpoint Security, Incident Response, Network Security, Security Information and Event Management (SIEM), Cryptography, Cyber Engineering, Cyber Operations, Cyber Threat Intelligence, Malware Analysis, Network Troubleshooting, Operating Systems",4.8,235,https://www.coursera.org/specializations/cbrops
International Women's Health and Human Rights,Stanford University,Human Services,4.9,5000,https://www.coursera.org/learn/womens-health-human-rights
Teach English Now! Foundational Principles,Arizona State University,"Language Acquisition, Education and Training, Critical Thinking and Problem Solving",4.9,14000,https://www.coursera.org/learn/english-principles
First Step Korean,Yonsei University,,4.9,49000,https://www.coursera.org/learn/learn-korean
Impact Measurement & Management for the SDGs,Duke University,"Sustainability Reporting, Corporate Sustainability, Data Collection",4.8,528,https://www.coursera.org/learn/impact-for-sdgs
Engineering Project Management,Rice University,"Project Management, Risk Management, Cost Estimation, Project Scoping, Quality Management, Risk Analysis, Teamwork, Construction Estimating, Contract Management, Initiative and Leadership, Problem Solving, Procurement, Quality Management Systems, Supplier Management",4.7,3000,https://www.coursera.org/specializations/engineering-project-management
Customer Service Fundamentals,Knowledge Accelerators,"Customer Service, Communication, Customer Inquiries, Customer Support, Problem Solving",4.8,6000,https://www.coursera.org/learn/customer-service-fundamentals
The Path to Insights: Data Models and Pipelines,Google,"Business Intelligence, Data Analysis, Data Management, Extraction, Transformation, and Loading (ETL)",4.7,369,https://www.coursera.org/learn/the-path-to-insights-data-models-and-pipelines
The Art of Visual Storytelling,University of Colorado Boulder,"Media Production, Production Management, Storytelling, Graphic and Visual Design, Design, Instructional and Curriculum Design, Writing and Editing",4.6,64,https://www.coursera.org/specializations/the-art-of-visual-storytelling
Robotic Process Automation (RPA),UiPath,"IT Automation, Automation, Programming Tools, UI Components, Computer Programming, R (Programming Language), Software Engineering, Software Engineering Tools, Workflow Management",4.7,348,https://www.coursera.org/specializations/roboticprocessautomation
IBM AI Enterprise Workflow,IBM,"MLOps (Machine Learning Operations), Artificial Intelligence and Machine Learning (AI/ML), Machine Learning, Artificial Intelligence, Business Process Management, Data Analysis, Data Management, Data Structures, Feature Engineering, Kubernetes, Operations Management, Scikit Learn (Machine Learning Library), Statistical Programming, Strategic Planning, Apache Spark, Data Modeling, Data Wrangling, Database Application, Database Software, Entrepreneurship, Exploratory Data Analysis, Extraction, Transformation, and Loading (ETL), Linear Algebra, Mathematics, Probability Distribution, Probability and Statistics, PySpark, Python (Programming Language), Statistical Hypothesis Testing, Time Series",4.3,263,https://www.coursera.org/specializations/ibm-ai-workflow
IELTS Preparation,"University of California, Irvine","Communication, Language Interpretation, Translation, and Studies, Education and Training, Instructional and Curriculum Design, Language Acquisition, Critical Thinking, Critical Thinking and Problem Solving",4.6,6000,https://www.coursera.org/specializations/ielts-preparation
Introduction to Philosophy,The University of Edinburgh,Psychology,4.7,1000,https://www.coursera.org/learn/philosophy
Managing Cybersecurity,University System of Georgia,"Cybersecurity, Network Security, Incident Response, Security Management, Business Continuity, Disaster Recovery, Governance Risk Management and Compliance, Identity and Access Management, Incident Management, Key Performance Indicators (KPIs), Regulation and Legal Compliance, Risk Management, Security Information and Event Management (SIEM), Vulnerability Management",4.8,1000,https://www.coursera.org/specializations/managing-cybersecurity
CompTIA a+ Network,CompTIA,,3.3,13,https://www.coursera.org/learn/comptia-aplus-network
Social Media Management,Meta,"Social Media, Content Marketing, Marketing Technology",4.9,8000,https://www.coursera.org/learn/social-media-management
Dynamic Public Speaking,University of Washington,"Communication, Influencing Skills, Logical Reasoning, Critical Thinking, Writing, Business Communications, Graphic Design",4.7,4000,https://www.coursera.org/specializations/public-speaking
Learn to Program: The Fundamentals,University of Toronto,"Python (Programming Language), Programming Concepts, Computer Programming",4.7,4000,https://www.coursera.org/learn/learn-to-program
Business Analytics,University of Illinois at Urbana-Champaign,"R (Programming Language), Data Analysis, Statistical Programming, Communication, Exploratory Data Analysis, Machine Learning, Accounting, Analytics, Business Analysis, Data Visualization, Marketing Analytics, Natural Language Processing, Automation, Business Communication, Customer Analysis, Data Analysis Software, Decision Tree Learning, Industrial and Organizational Psychology, Marketing Effectiveness, Network Analysis, Power BI, Statistical Analysis",4.6,919,https://www.coursera.org/specializations/analytics
Investment and Portfolio Management,Rice University,"Investment Management, Financial Analysis, Finance, Risk Management, Economics, Financial Modeling, Industrial and Organizational Psychology, Financial Management, Regression Analysis, Securities Trading",4.5,5000,https://www.coursera.org/specializations/investment-portolio-management
Positive Psychiatry and Mental Health,The University of Sydney,"Mental Health, Behavioral Health, Mental Health Therapies",4.8,5000,https://www.coursera.org/learn/positive-psychiatry
Cancer Biology,Johns Hopkins University,"Medical Science and Research, General Medical Tests and Procedures, Treatment Planning, Clinical Trials, Life Sciences, Patient Education and Support",4.8,2000,https://www.coursera.org/specializations/cancer-biology
Clinical Terminology for International and U.S. Students,University of Pittsburgh,"Medical Terminology, Emergency and Intensive Care, Direct Patient Care",4.8,3000,https://www.coursera.org/learn/clinical-terminology
Getting Started with Power BI Desktop,Coursera Project Network,"Power BI, Business Intelligence, Data Analysis, Data Analysis Software, Data Visualization",4.7,6000,https://www.coursera.org/projects/power-bi-desktop
Supply Chain Analytics,Rutgers the State University of New Jersey,"Analytics, Inventory Management, Data Analysis, Advanced Analytics, Business Intelligence, Regression Analysis, Supplier Management, Supply Chain, Supply Chain Management, Intelligence Collection and Analysis, Key Performance Indicators (KPIs), Market Analysis, Marketing Analytics, Operational Support and Analysis",4.6,2000,https://www.coursera.org/specializations/supply-chain-analytics
Blockchain,University at Buffalo,"Blockchain, Cryptography, Finance, Security Engineering, Programming Concepts, Application Programming Interface (API), Financial Technology (Fintech), Information Assurance, JavaScript Frameworks, Javascript and jQuery, Theory of Computation, Unit Testing",4.6,7000,https://www.coursera.org/specializations/blockchain
Introduction to Finance: The Basics,University of Illinois at Urbana-Champaign,"Financial Analysis, Corporate Accounting, Financial Management",4.7,334,https://www.coursera.org/learn/introduction-to-finance-the-basics
Removing Barriers to Change,University of Pennsylvania,"Change Management, Business Transformation, Critical Thinking and Problem Solving",4.9,400,https://www.coursera.org/learn/removing-barriers-to-change
Software Design and Architecture,University of Alberta,"Software Architecture, Object Oriented Design, Service Oriented Architecture, Software Design Patterns, Software Engineering, Restful API, Object Oriented Programming (OOP), Simple Object Access Protocol (SOAP)",4.6,7000,https://www.coursera.org/specializations/software-design-architecture
Introduction to Electronics,Georgia Institute of Technology,,4.7,5000,https://www.coursera.org/learn/electronics
School Health for Children and Adolescents,University of Colorado System,"Mental and Behavioral Health Specialties, Nursing Practices, Teamwork, Education and Training, Emergency and Intensive Care, First Aid, Mental Health, Mental Health Therapies, Community and Social Work, Data Collection, Direct Patient Care, Disabilities, Emotional Intelligence, Instructional and Curriculum Design, Meal Planning and Preparation, Patient Education and Support, Physical Therapy, Psychology",4.8,3000,https://www.coursera.org/specializations/school-health-for-children-and-adolescents
Advanced Digital Transformation,IIMA - IIM Ahmedabad,,4.6,25,https://www.coursera.org/specializations/advanced-digital-transformation-iima
Go Beyond the Numbers: Translate Data into Insights,Google,"Data Visualization, Exploratory Data Analysis, Data Analysis, Data Science, Data Visualization Software",4.8,471,https://www.coursera.org/learn/go-beyond-the-numbers-translate-data-into-insight
Convolutional Neural Networks in TensorFlow,DeepLearning.AI,"TensorFlow, Deep Learning, Machine Learning, Machine Learning Methods",4.7,8000,https://www.coursera.org/learn/convolutional-neural-networks-tensorflow
Rust Programming,Duke University,"C Based Programming Languages, Data Structures, GitHub, Unit Testing",4.2,49,https://www.coursera.org/specializations/rust-programming
Optical Engineering,University of Colorado Boulder,,4.4,336,https://www.coursera.org/specializations/optical-engineering
Managerial Accounting Fundamentals,University of Virginia,"Cost Accounting, Management Accounting, Accounting",4.8,742,https://www.coursera.org/learn/uva-darden-managerial-accounting
The Pronunciation of American English,"University of California, Irvine",,4.8,997,https://www.coursera.org/specializations/american-english-pronunciation
Statistical Analysis with R for Public Health,Imperial College London,"R (Programming Language), Regression Analysis, Statistical Analysis, Statistical Hypothesis Testing, Statistical Programming, Correlation Analysis, Descriptive Statistics, Probability Distribution, Statistics",4.7,9000,https://www.coursera.org/specializations/statistical-analysis-r-public-health
Software Testing and Automation,University of Minnesota,"Software Testing, Software Engineering, Computer Programming, Java Programming, Mobile Development Tools, Web Development, Problem Solving, Data Analysis Software, Programming Principles, System Software, Android Development, HTML and CSS, Mobile Development, Other Web Frameworks, Planning, Web Development Tools, iOS Development",4.3,815,https://www.coursera.org/specializations/software-testing-automation
Data Management for Clinical Research,Vanderbilt University,"Clinical Data Management, Data Management, Data Structures, Planning, Critical Thinking, Database Administration",4.7,6000,https://www.coursera.org/learn/clinical-data-management
Transforming the Fashion Business,"Parsons School of Design, The New School","Leadership and Management, Research and Design, Brand Management, Design and Product, Strategy and Operations, Supply Chain Systems, Supply Chain and Logistics, Innovation, Marketing, Product Management, Collaboration, Communication, Entrepreneurship, Retail Sales, Sales, Strategy, Business Design, E-Commerce, Interactive Design, Product Lifecycle, Forecasting, Merchandising, Product Design, Visual Design",4.7,465,https://www.coursera.org/specializations/transforming-fashion-business
Corporate Strategy,University of London,"Entrepreneurship, Leadership and Management, Marketing, Sales, Strategy, Strategy and Operations, Finance, Mergers & Acquisitions, Business Development",4.8,1000,https://www.coursera.org/learn/corporatestrategy
The Fundamentals of Personal Finance,SoFi,"Finance, Leadership and Management, Planning, Risk Management, Financial Management, Cash Management, Accounting, Taxes",4.6,243,https://www.coursera.org/specializations/personal-finance-fundamentals
PostgreSQL for Everybody,University of Michigan,"SQL, Databases, Database Design, PostgreSQL, Database Application, Data Management, Database Theory, Data Structures, Python Programming, Data Architecture, NoSQL, Data Model, Natural Language Processing",4.7,1000,https://www.coursera.org/specializations/postgresql-for-everybody
Foundations of Software Testing and Validation,University of Leeds,Software Testing,4.6,132,https://www.coursera.org/learn/foundations-of-software-testing-and-validation
Security Awareness Training,ISC2,"Human Factors (Security), Security Engineering, Security Strategy, Software Security, System Security, Network Security, Security Software, Human Computer Interaction, Mobile Security, Training",4.7,2000,https://www.coursera.org/learn/security-awareness-training
Real-World Product Management,Advancing Women in Tech,"Leadership and Management, Product Strategy, Product Management, Strategy, Marketing, Strategy and Operations, Product Marketing, Business Development, Business Process Management, Market Analysis",4.5,840,https://www.coursera.org/specializations/real-world-product-management
Music Education for Teachers,Berklee,Writing,4.8,8000,https://www.coursera.org/specializations/music-education
Introduction to Engineering Mechanics,Georgia Institute of Technology,,4.8,8000,https://www.coursera.org/learn/engineering-mechanics-statics
Hands-on Introduction to Linux Commands and Shell Scripting,IBM,Linux,4.7,1000,https://www.coursera.org/learn/hands-on-introduction-to-linux-commands-and-shell-scripting
Introduction to DevOps,IBM,"DevOps, Continuous Delivery, Continuous Integration, Software Engineering",4.8,5000,https://www.coursera.org/learn/intro-to-devops
Behavioral Finance,Duke University,"Behavioral Economics, Business Psychology, Critical Thinking, Decision Making, Finance, Investment Management, People Analysis, Probability & Statistics, Problem Solving, Strategy",4.4,9000,https://www.coursera.org/learn/duke-behavioral-finance
From Excel to Power BI,Knowledge Accelerators,"Data Analysis, Data Model, Data Visualization, Microsoft Excel, Power BI",4.4,340,https://www.coursera.org/learn/from-excel-to-power-bi
Exploratory Data Analysis for Machine Learning,IBM,"Data Analysis, Exploratory Data Analysis, Machine Learning, Statistical Machine Learning, Feature Engineering, General Statistics, Probability & Statistics, Statistical Analysis, Algorithms, Data Structures",4.6,6000,https://www.coursera.org/learn/ibm-exploratory-data-analysis-for-machine-learning
Coding for Everyone: C and C++,"University of California, Santa Cruz","C Programming Language Family, Computer Programming, Programming Principles, Algorithms, Data Structures, C++ Programming, Computational Logic, Computer Programming Tools, Computational Thinking, Critical Thinking, Mathematics, Problem Solving, Graph Theory, Software Engineering",4.5,9000,https://www.coursera.org/specializations/coding-for-everyone
Economics of Money and Banking,Columbia University,"Banking, Finance",4.9,6000,https://www.coursera.org/learn/money-banking
