Course_Name,Company_Offering,Skills_Gained,Ratings,Number_of_Ratings,Course_Link
"Advanced Valuation and Strategy - M&A, Private Equity, and Venture Capital",Erasmus University Rotterdam,"Finance, Mergers & Acquisitions, Business Analysis, Data Analysis, Financial Analysis, Investment Management, Accounting, Leadership and Management, Sales, Strategy, Game Theory",4.6,2000,https://www.coursera.org/learn/advanced-valuation-and-strategy
Supply Chain Management and Analytics,Unilever,"Data Analysis, Data Visualization, Problem Solving, Risk Management",4.8,22,https://www.coursera.org/learn/supply-chain-management-and-analytics
C Programming for Everybody,University of Michigan,,5.0,14,https://www.coursera.org/specializations/c-programming-for-everybody
Power Electronics,University of Colorado Boulder,,4.7,4000,https://www.coursera.org/specializations/power-electronics
Project Management: Foundations and Initiation,University of Colorado Boulder,"Leadership and Management, Project Management, Planning, Strategy and Operations, People Management, Performance Management, Product Management, Business Communication, Business Process Management, Strategy",4.8,388,https://www.coursera.org/learn/project-management-foundations-initiation
"Negotiation, Mediation and Conflict Resolution",ESSEC Business School,"Communication, Marketing, Negotiation, Sales, Collaboration, Leadership and Management, Business Communication, Business Psychology, Conflict Management, Culture, Human Resources, Leadership Development, Planning, Strategy",4.7,2000,https://www.coursera.org/specializations/negotiation-mediation-conflict-resolution
Functional Programming in Scala,cole Polytechnique Fdrale de Lausanne,"Computer Programming, Programming Principles, Scala Programming, Theoretical Computer Science, Computational Thinking, Critical Thinking, Data Structures, Big Data, Algorithms, Apache, SQL",4.7,11000,https://www.coursera.org/specializations/scala
Extended Reality for Everybody,University of Michigan,"Human Computer Interaction, Virtual Reality, Computer Graphics, Interactive Design, User Experience, User Experience Design, Design and Product, Research and Design, Application Development, Product Development, Computer Programming, Product Design, Visual Design, Systems Design",4.7,469,https://www.coursera.org/specializations/extended-reality-for-everybody
International Leadership and Organizational Behavior,Universit Bocconi,"Leadership and Management, Business Psychology, Culture, Human Resources, Communication, Entrepreneurship, Leadership Development, Organizational Development, Conflict Management",4.8,2000,https://www.coursera.org/learn/organizational-behavior
Leading Diverse Teams & Organizations,University of Michigan,"Communication, Leadership and Management",4.7,384,https://www.coursera.org/learn/leading-diverse-teams-and-organizations
Wind Energy,Technical University of Denmark (DTU),,4.7,1000,https://www.coursera.org/learn/wind-energy
Data Science with Databricks for Data Analysts,Databricks,"Data Analysis, Machine Learning, Machine Learning Algorithms, Algorithms, Exploratory Data Analysis, Human Learning, Python Programming, Apache, Applied Machine Learning, Data Management, SQL, Regression, Big Data, Feature Engineering, Statistical Programming, Data Science",4.5,551,https://www.coursera.org/specializations/data-science-with-databricks-for-data-analysts
Introduction to Relational Databases (RDBMS),IBM,"Data Management, Database Administration, Database Application, Database Design, Databases, SQL, Data Architecture, Data Structures, Data Model, Database Theory, PostgreSQL",4.6,514,https://www.coursera.org/learn/introduction-to-relational-databases
.NET FullStack Developer,Board Infinity,"Computer Programming, Javascript, React (web framework)",4.1,121,https://www.coursera.org/specializations/dot-net-fullstack
"AI, Business & the Future of Work",Lund University,"Leadership and Management, Strategy, Algorithms, Human Computer Interaction, Human Resources, Machine Learning, Machine Learning Algorithms, Human Learning, Machine Learning Software, Organizational Development",4.7,478,https://www.coursera.org/learn/ai-business-future-of-work
Developing Front-End Apps with React,IBM,"Front-End Web Development, Javascript, React (web framework), Web Development",4.3,378,https://www.coursera.org/learn/developing-frontend-apps-with-react
Understanding Research Methods,University of London,"Planning, Writing",4.6,2000,https://www.coursera.org/learn/research-methods
Organizational Change and Culture for Adopting Google Cloud,Google Cloud,"Leadership and Management, Strategy and Operations, Cloud Computing, Business Transformation, Collaboration, DevOps, Communication, Innovation, Product Development, Strategy, Design and Product, Change Management, Business Analysis, Business Intelligence, Customer Analysis, Data Analysis, Data Management, Entrepreneurship, Google Cloud Platform, Product Management, Cloud Platforms, Continuous Delivery, Culture, Google App Engine",4.7,6000,https://www.coursera.org/specializations/organizational-change-and-culture-for-adopting-google-cloud
Miracles of Human Language: An Introduction to Linguistics,Universiteit Leiden,,4.7,4000,https://www.coursera.org/learn/human-language
Digital Signal Processing,cole Polytechnique Fdrale de Lausanne,"Mathematics, Mathematical Theory & Analysis, Algebra, Linear Algebra, Plot (Graphics), Algorithms, Applied Mathematics, Critical Thinking, Calculus",4.5,682,https://www.coursera.org/specializations/digital-signal-processing
Using Public Policy for Social Change,University of Michigan,Problem Solving,5.0,24,https://www.coursera.org/learn/using-public-policy-for-social-change
Learning and Development,HRCI,"Employee Training, Human Resources Management and Planning, Training and Development",4.7,235,https://www.coursera.org/learn/learning-and-development
CVS Health Retail Customer Service,CVS Health,"Customer Service, Communication",4.7,87,https://www.coursera.org/professional-certificates/cvshealth-retail-customer-service
Finance for Technical Managers,University of Colorado Boulder,"Financial Analysis, Mathematics and Mathematical Modeling, Cost Accounting, Financial Modeling, Cost Estimation, Cash Flow Forecasting, Critical Thinking, Critical Thinking and Problem Solving, Economics, Economics, Policy, and Social Studies, Entrepreneurial Finance, Financial Management, Financial Planning, Financial Reporting, Investment Management, Microsoft Excel, Regression Analysis, Risk Management, Specialized Accounting, Spreadsheets",4.7,116,https://www.coursera.org/specializations/finance-for-technical-managers
Akamai Network Engineering,"Akamai Technologies, Inc.","SQL (Programming Language), Python (Programming Language), Cybersecurity, Operating Systems, Linux, Network Administration, Network Security, Network Troubleshooting, Bash (Scripting Language), Identity and Access Management, Security Engineering, Authentications, Authorization (Computing), Cyber Risk, Data Storage, Encryption, Firewall, Network Architecture, Network Protocols, Penetration Testing, Systems Administration, Text Mining, Virtual Private Networks (VPN)",4.8,61,https://www.coursera.org/professional-certificates/akamai-network-engineering
Medical Billing and Coding Essentials,MedCerts,"Billing and Invoicing, Health Care Procedure and Regulation, Insurance, Payment Processing",4.7,193,https://www.coursera.org/learn/medical-billing-coding-essentials
Evaluations of AI Applications in Healthcare,Stanford University,"Artificial Intelligence and Machine Learning (AI/ML), Machine Learning, Artificial Intelligence",4.6,202,https://www.coursera.org/learn/evaluations-ai-applications-healthcare
Core Java,LearnQuest,"Java, Object Oriented Programming (OOP), Java (Programming Language), Computer Programming, Application Security",4.6,2000,https://www.coursera.org/specializations/core-java
Write Your First Novel,Michigan State University,,4.3,300,https://www.coursera.org/learn/write-your-first-novel
Linux and Private Cloud Administration on IBM Power Systems,Red Hat,"Virtualization and Virtual Machines, Linux, Cloud Computing, Cloud Management, IBM Cloud Computing, Systems Administration",4.8,992,https://www.coursera.org/specializations/linux-private-cloud-administration-power-systems
Excel Skills for Business: Intermediate I,Macquarie University,"Microsoft Excel, Spreadsheets, Data Entry",4.9,17000,https://www.coursera.org/learn/excel-intermediate-1
Climate Change and Sustainable Investing,EDHEC Business School,"Economics, Policy, and Social Studies, Investment Management, Economics, Corporate Sustainability, Mathematics and Mathematical Modeling, Financial Analysis, Entrepreneurial Finance, Environment and Resource Management, Financial Industry Regulatory Authorities, Physical Science, Physics, Regression Analysis",4.7,305,https://www.coursera.org/specializations/climatechangeandsustainableinvesting
How to Play Guitar,Berklee,,4.8,5000,https://www.coursera.org/specializations/play-guitar
Accounting: Principles of Financial Accounting,IESE Business School,"Accounting, Financial Accounting, Financial Statements",4.8,3000,https://www.coursera.org/learn/financial-accounting
Mathematics for Engineers,The Hong Kong University of Science and Technology,"Mathematics and Mathematical Modeling, Differential Equations, MATLAB, Linear Algebra, Calculus, Engineering Calculations",4.8,7000,https://www.coursera.org/specializations/mathematics-engineers
Fundamentals of Engineering Exam Review,Georgia Institute of Technology,"Civil Engineering, Probability Distribution, Probability and Statistics",4.7,606,https://www.coursera.org/learn/fe-exam
Design of Industrial Piping Systems,L&T EduTech,,4.5,8,https://www.coursera.org/specializations/design-of-industrial-piping-systems
Corporate Sustainability. Understanding and Seizing the Strategic Opportunity,Universit Bocconi,"Corporate Sustainability, Change Management, Sustainability Reporting",4.6,786,https://www.coursera.org/learn/corp-sustainability
Abnormal Psychology,Wesleyan University,"Psychology, Mental Health, Behavioral Health, Mental Health Therapies, Crisis Intervention, Critical Thinking and Problem Solving, Influencing Skills, Reinforcement Learning",4.8,482,https://www.coursera.org/specializations/abnormal-psychology
"The Sustainable Development Goals  A global, transdisciplinary vision for the future",University of Copenhagen,"Resilience, Sustainability Reporting",4.8,3000,https://www.coursera.org/learn/global-sustainable-development
Digital Health,Imperial College London,"Electronic Medical Record, Clinical Trials, Human Computer Interaction, Data Analysis, Data Visualization, Design, Digital Marketing, Epidemiology, General Data Protection Regulation (GDPR), Health Care, Health Information Management and Medical Records, Mobile Application Development, Regulation and Legal Compliance",4.5,219,https://www.coursera.org/specializations/digitalhealth
Python Project for Data Engineering,IBM,"Data Analysis Software, Extract Transform Load (ETL), Extraction, Transformation, and Loading (ETL), PySpark",4.6,575,https://www.coursera.org/learn/python-project-for-data-engineering
Astronomy: Exploring Time and Space,University of Arizona,"Physical Science, Physics, Scientific Visualization",4.8,6000,https://www.coursera.org/learn/astro
Social Media Marketing,Northwestern University,"Social Media, Communications, Marketing, Digital Marketing, Media Strategy, Entrepreneurship, Market Research, Marketing Management, Research and Development, Content Marketing, Marketing Analytics, Marketing Strategy and Techniques, Influencing Skills, Advertising, Brand Management, Business Analysis, Continuous Monitoring, Customer Analysis, Email Marketing, Information Privacy, Integrated Marketing Communications, Management, Operations Management, Sales, Strategic Planning, Strategic Thinking, Text Mining, Writing and Editing",4.6,3000,https://www.coursera.org/specializations/social-media-marketing
Financial Planning for Young Adults,University of Illinois at Urbana-Champaign,"Financial Planning, Insurance, General Finance",4.6,3000,https://www.coursera.org/learn/financial-planning
"Decisions, Decisions: Dashboards and Reports",Google,"Business Intelligence, Data Visualization, Dashboard, Power BI",4.8,540,https://www.coursera.org/learn/decisions-decisions-dashboards-and-reports
Wine Tasting: Sensory Techniques for Wine Analysis,"University of California, Davis",,4.7,501,https://www.coursera.org/learn/wine
Inspired Leadership,Case Western Reserve University,"Management, Communications, Leadership Development, Emotional Intelligence, Influencing Skills, Human Resource Planning, Change Management, Entrepreneurship, Industrial and Organizational Psychology, Initiative and Leadership, Business Leadership, Critical Thinking and Problem Solving, Life Skills Development, Training and Development, Collaboration, Marketing, Organizational Development, Business Strategy, Communication, Diversity and Inclusion, Education and Training, General Networking, Lifelong Learning, Market Research, Negotiation, Operations Management, Personal Attributes, Research and Development, Sales, Storytelling, Strategic Planning",4.7,4000,https://www.coursera.org/specializations/inspired-leadership
Coding for Beginners: An Easy Introduction,IBM,Computer Programming,2.9,20,https://www.coursera.org/projects/coding-for-beginners-an-easy-introduction
Business Model Innovation,HEC Paris,"Business Modeling, Business Strategies, New Business Development",4.8,554,https://www.coursera.org/learn/business-model
Value Chain Management,University of Illinois at Urbana-Champaign,"Cost Accounting, Marketing Strategy and Techniques, Management Accounting, Operations Management, Financial Analysis, Brand Management, Inventory Management, Marketing, Process Improvement and Optimization, Supply Chain Management, Advertisement, Branding, Budgeting, Business Strategies, Cost Estimation, Inventory Control, Marketing Channel, Performance Management, Process Improvement, Quality Management, Variance Analysis",4.7,8000,https://www.coursera.org/specializations/value-chain-management
Natural Language Processing with Sequence Models,DeepLearning.AI,"Natural Language Processing, Artificial Intelligence and Machine Learning (AI/ML), Machine Learning Methods",4.5,1000,https://www.coursera.org/learn/sequence-models-in-nlp
Learn English: Intermediate Grammar,"University of California, Irvine",,4.8,2000,https://www.coursera.org/specializations/intermediate-grammar
Psychological Research,American Psychological Association,"Research, Statistical Analysis, Statistical Hypothesis Testing, Psychology, Critical Thinking, Critical Thinking and Problem Solving, Data Collection, Data Integrity, Data Visualization, Science and Research, Statistics",4.7,70,https://www.coursera.org/specializations/psychological-research
Python Basics,University of Michigan,"Python (Programming Language), Computer Programming, Programming Concepts",4.8,17000,https://www.coursera.org/learn/python-basics
CAD and Digital Manufacturing,Autodesk,"Computer Aided Design, Drafting and Engineering Design, Simulation and Simulation Software, AutoCAD, Collaboration, Design, Design Thinking, Tooling, User Interface (UI)",4.7,5000,https://www.coursera.org/specializations/cad-design-digital-manufacturing
C Programming with Linux,Dartmouth College,"C (Programming Language), C Based Programming Languages, Linux, Programming Concepts, Bash (Scripting Language), Unix, Computational Logic, Computational Thinking, Computer Programming, Critical Thinking, Critical Thinking and Problem Solving, Natural Language Processing",4.6,301,https://www.coursera.org/specializations/c-programming-linux
Navigating Generative AI for Leaders,Coursera,,5.0,20,https://www.coursera.org/specializations/navigating-generative-ai-for-leaders
Foundations of Business Strategy,University of Virginia,"Entrepreneurship, Leadership and Management, Marketing, Sales, Strategy, Strategy and Operations, Market Analysis",4.8,9000,https://www.coursera.org/learn/uva-darden-foundations-business-strategy
Advanced React,Meta,"Web Development, Front-End Web Development, Javascript, React (web framework), Web Design",4.6,952,https://www.coursera.org/learn/advanced-react
Machine Learning and Reinforcement Learning in Finance,New York University,"Machine Learning, Human Learning, Machine Learning Algorithms, Algorithms, Finance, Mathematics, Regression, Statistical Machine Learning, Applied Machine Learning, Data Analysis, Deep Learning, Reinforcement Learning, Tensorflow",3.7,787,https://www.coursera.org/specializations/machine-learning-reinforcement-finance
Agile Leadership,University of Colorado System,"Leadership and Management, Business Psychology, Entrepreneurship, Communication, Strategy and Operations, Leadership Development, Change Management, Organizational Development, Project Management, Adaptability, Collaboration, Emotional Intelligence, Human Resources, Resilience, Business Transformation, Strategy, Business Communication, Professional Development, Scrum (Software Development)",4.8,4000,https://www.coursera.org/specializations/agile-leadership-change-management
Introduction to Cybersecurity Fundamentals,Coursera Instructor Network,Computer Security Incident Management,4.7,94,https://www.coursera.org/learn/introduction-to-cybersecurity-fundamentals
Introductory C Programming,Duke University,"Python Programming, Computer Programming, C Programming Language Family, Algorithms, Computational Logic, Critical Thinking, Problem Solving, Process Analysis, Programming Principles, Computer Programming Tools, Data Visualization, Theoretical Computer Science, Computational Thinking, Software Testing, Writing, Software Engineering, User Experience",4.6,1000,https://www.coursera.org/specializations/c-programming
Write Professional Emails in English,Georgia Institute of Technology,"Writing, Business Communication, Professional Development",4.8,17000,https://www.coursera.org/learn/professional-emails-english
Blockchain Revolution in Financial Services,INSEAD,"BlockChain, Finance, Cryptography, FinTech, Business Transformation, Innovation, Distributed Computing Architecture, Payments, Leadership and Management, System Security, Network Security, Accounting, Banking, Business Process Management, Financial Accounting, Financial Management, Organizational Development, Problem Solving, Security Strategy, Data Management",4.7,944,https://www.coursera.org/specializations/blockchain-financial-services
Marketing with TikTok,Aptly,"Marketing, Social Media, Digital Marketing, Media Strategy & Planning, Advertising Sales, Media Production, E-Commerce, Sales, Strategy, Market Analysis",4.7,126,https://www.coursera.org/specializations/marketing-with-tiktok
Introduction to Git and GitHub,Google,"Collaboration, Computer Programming, Python Programming",4.8,3000,https://www.coursera.org/learn/introduction-git-github
"Introduction to Containers w/ Docker, Kubernetes & OpenShift",IBM,"Kubernetes, Docker (Software), Cloud Computing",4.4,729,https://www.coursera.org/learn/ibm-containers-docker-kubernetes-openshift
Introduction to Sustainability,University of Illinois at Urbana-Champaign,,4.8,5000,https://www.coursera.org/learn/sustainability
ESG Risks and Opportunities,University of Pennsylvania,"Critical Thinking, Investment Management, Leadership and Management, Regulations and Compliance, Risk Management, Strategy, Strategy and Operations, Business Analysis, Business Transformation, Decision Making",4.6,583,https://www.coursera.org/learn/esg-risks-opportunities
Liabilities and Equity in Accounting,Intuit,"Accounting, Financial Accounting, General Accounting, Finance, Financial Management, Taxes",4.3,572,https://www.coursera.org/learn/liabilities-equity-in-accounting
Dog Emotion and Cognition,Duke University,,4.7,5000,https://www.coursera.org/learn/dog-emotion-and-cognition
Driving business towards the Sustainable Development Goals,Erasmus University Rotterdam,"Critical Thinking, Innovation, Leadership and Management, Problem Solving, Strategy, Business Transformation, Collaboration, Entrepreneurship, People Development, Decision Making",4.8,3000,https://www.coursera.org/learn/sdgbusiness
Developing Back-End Apps with Node.js and Express,IBM,"Javascript, Web Development, Computer Science",4.5,320,https://www.coursera.org/learn/developing-backend-apps-with-nodejs-and-express
Generative AI Primer,Vanderbilt University,,4.7,95,https://www.coursera.org/learn/generative-ai
Version Control with Git,Atlassian,"Agile Software Development, Collaboration, Computer Programming Tools, DevOps, Devops Tools, Software Engineering, Software Engineering Tools, Application Development, Project Management, Continuous Delivery",4.7,9000,https://www.coursera.org/learn/version-control-with-git
The Arts and Science of Relationships: Understanding Human Needs,University of Toronto,"Emotional Intelligence, Communication",4.5,6000,https://www.coursera.org/learn/human-needs
Digital Marketing Strategy and Planning,Digital Marketing Institute,"Digital Marketing, Marketing, Strategy, Strategy and Operations, Communication, Media Strategy & Planning, Customer Relationship Management, Leadership and Management, Market Analysis, Planning, User Experience, Social Media",4.6,393,https://www.coursera.org/specializations/digital-marketing-strategy-planning
"Information Systems Auditing, Controls and Assurance",The Hong Kong University of Science and Technology,"Security Engineering, Strategy and Operations, Change Management, Audit, Leadership and Management, Risk Management",4.7,3000,https://www.coursera.org/learn/information-systems-audit
FinTech: Finance Industry Transformation and Regulation,The Hong Kong University of Science and Technology,"FinTech, Finance, Risk Management, Banking, Leadership and Management, Innovation, Regulations and Compliance, BlockChain, E-Commerce, Financial Analysis, Business Process Management, Data Analysis, Exploratory Data Analysis, Payments, Business Development, Computer Security Incident Management, Human Factors (Security)",4.7,784,https://www.coursera.org/specializations/fintech
Essentials of Global Health,Yale University,"Behavioral Health, Human Services, Nursing",4.9,2000,https://www.coursera.org/learn/essentials-global-health
Positive Psychology: Martin E. P. Seligmans Visionary Science,University of Pennsylvania,"Psychology, Mental Health, Resilience",4.9,8000,https://www.coursera.org/learn/positive-psychology-visionary-science
Science of Diet and Exercise,National Academy of Sports Medicine,,4.7,62,https://www.coursera.org/specializations/nasm-science-of-diet-and-exercise
Improving Communication Skills,University of Pennsylvania,"Communication, Business Communications, General Networking",4.7,9000,https://www.coursera.org/learn/wharton-communication-skills
Essentials in Clinical Simulations Across the Health Professions,The George Washington University,"Simulation and Simulation Software, Instructional and Curriculum Design, Simulations, Nursing",4.8,986,https://www.coursera.org/learn/clinicalsimulations
Advanced Financial Reporting: Accounting for Business Combinations and Preparation of Consolidated Financial Statements,University of Illinois at Urbana-Champaign,"Mergers and Acquisitions, Financial Reporting, Corporate Accounting",4.7,175,https://www.coursera.org/learn/advanced-financial-reporting
Biology Meets Programming: Bioinformatics for Beginners,University of California San Diego,Bioinformatics,4.2,5000,https://www.coursera.org/learn/bioinformatics
Emotional Intelligence: Cultivating Immensely Human Interactions,University of Michigan,"Communications, Emotional Intelligence, Management, Initiative and Leadership, Social Skills",4.7,285,https://www.coursera.org/learn/emotional-intelligence-cultivating-immensely-human-interactions
American Contract Law I,Yale University,"Contract Management, Advertisement",4.9,877,https://www.coursera.org/learn/contracts-1
Principles of UX/UI Design,Meta,"User Experience (UX), UI/UX Strategy, User Centered Design, User Experience (UX) Design, Human Computer Interaction, Web Design",4.7,681,https://www.coursera.org/learn/principles-of-ux-ui-design
Teach English Now! Capstone Project 1,Arizona State University,,4.9,2000,https://www.coursera.org/learn/teaching-english-capstone
Coaching Skills for Managers,"University of California, Davis","Training and Development, Communications, Entrepreneurship, Industrial Relations, Industrial and Organizational Psychology, Leadership Development, Management, Operations Management, People Management, Performance Management, Strategic Planning, Education and Training, Human Resource Planning, Communication, Emotional Intelligence, Business Communications, Business Management, Business Strategies, Client Support, Collaboration, Critical Thinking and Problem Solving, Initiative and Leadership",4.8,6000,https://www.coursera.org/specializations/coaching-skills-manager
Arts and Heritage Management,Universit Bocconi,"Brand Management, Experience Design, User Experience (UX) Design",4.8,3000,https://www.coursera.org/learn/arts-heritage
Business and Marketing Strategies,University of London,"Operations Management, Market Analysis, Marketing, Marketing Strategies, Business Strategies, Critical Thinking, Digital Marketing, Marketing Strategy and Techniques, New Product Development, Social Media",4.4,185,https://www.coursera.org/specializations/uol-business-and-marketing-strategies
International Organizations Management,University of Geneva,"Brand Management, Branding, Business Development",4.8,8000,https://www.coursera.org/learn/international-organizations-management
